{
  "$schema": "https://voidb.dev/schemas/plugin-registry.schema.json",
  "schema_version": 1,
  "registry_name": "VoidB Official Plugin Registry",
  "registry_url": "https://raw.githubusercontent.com/limmytian/voidb/main/registry/index.json",
  "updated_at": "2026-11-02T00:32:59.127925454Z",
  "plugins": [
    {
      "id": "docker",
      "name": "Docker Container Management Plugin",
      "description": "Docker container and runtime management plugin for VoidB.",
      "homepage": "https://github.com/limmytian/voidb-plugin-docker",
      "license": "Apache-2.0",
      "category": "infrastructure",
      "tags": [
        "docker"
      ],
      "capabilities": [
        "diagnostics",
        "list_containers",
        "list_images",
        "list_networks",
        "list_volumes",
        "inspect_container",
        "logs",
        "logs_follow",
        "stats_follow",
        "events_follow",
        "exec_read",
        "exec_input",
        "exec_resize",
        "exec_signal",
        "attach_read",
        "attach_input",
        "attach_resize",
        "container_action"
      ],
      "latest_version": "0.3.5",
      "versions": [
        {
          "version": "0.3.3",
          "protocol_version": "1",
          "released_at": "2026-10-11T19:19:20.493994Z",
          "voidb_core": ">=0.3.3",
          "platforms": [
            "darwin",
            "linux"
          ],
          "packages": [
            {
              "filename": "docker-0.3.3-aarch64-apple-darwin.tar.gz",
              "format": "tar.gz",
              "target": "aarch64-apple-darwin",
              "url": "https://github.com/limmytian/voidb-plugin-docker/releases/download/v0.3.3/docker-0.3.3-aarch64-apple-darwin.tar.gz",
              "sha256": "sha256:a790902bcc0e95ad804e29f51042412d2dfa5b3e0c08621d3c7f56096eab6d8e",
              "size_bytes": 3070559
            },
            {
              "filename": "docker-0.3.3-aarch64-unknown-linux-gnu.tar.gz",
              "format": "tar.gz",
              "target": "aarch64-unknown-linux-gnu",
              "url": "https://github.com/limmytian/voidb-plugin-docker/releases/download/v0.3.3/docker-0.3.3-aarch64-unknown-linux-gnu.tar.gz",
              "sha256": "sha256:9f0b7119bdf5864b8a71332331e026f290ba32b38194a3174579dd6640ee6a04",
              "size_bytes": 3339970
            },
            {
              "filename": "docker-0.3.3-x86_64-apple-darwin.tar.gz",
              "format": "tar.gz",
              "target": "x86_64-apple-darwin",
              "url": "https://github.com/limmytian/voidb-plugin-docker/releases/download/v0.3.3/docker-0.3.3-x86_64-apple-darwin.tar.gz",
              "sha256": "sha256:3972bbd41bad876eab7a7b3a468e66466a5a96cf559745c61afd34dffb21e554",
              "size_bytes": 3189067
            },
            {
              "filename": "docker-0.3.3-x86_64-unknown-linux-gnu.tar.gz",
              "format": "tar.gz",
              "target": "x86_64-unknown-linux-gnu",
              "url": "https://github.com/limmytian/voidb-plugin-docker/releases/download/v0.3.3/docker-0.3.3-x86_64-unknown-linux-gnu.tar.gz",
              "sha256": "sha256:9c3220e61c0c7300e4680258a564ae7d62e9451d235a4eeae67f9cd62074eb3f",
              "size_bytes": 3629254
            }
          ]
        },
        {
          "version": "0.3.4",
          "protocol_version": "1",
          "released_at": "2026-10-12T11:27:53.627224Z",
          "voidb_core": ">=0.3.3",
          "platforms": [
            "darwin",
            "linux"
          ],
          "signature_scheme": "ed25519",
          "packages": [
            {
              "filename": "docker-0.3.4-aarch64-apple-darwin.tar.gz",
              "format": "tar.gz",
              "target": "aarch64-apple-darwin",
              "url": "https://github.com/limmytian/voidb-plugin-docker/releases/download/v0.3.4/docker-0.3.4-aarch64-apple-darwin.tar.gz",
              "sha256": "sha256:3d1bab512259777daf7a1971cd79cc9d31214949bf21cce7fec25900777666c5",
              "size_bytes": 3057901,
              "signature": "1c772c4f1f035fb70623dfa854d7de29f6b4794a8099a416c04544126052748cca5d94a0a695f2e3208d4af8800aece9ad8c14a73e41e0f3c0ddc963b3731c05"
            },
            {
              "filename": "docker-0.3.4-aarch64-unknown-linux-gnu.tar.gz",
              "format": "tar.gz",
              "target": "aarch64-unknown-linux-gnu",
              "url": "https://github.com/limmytian/voidb-plugin-docker/releases/download/v0.3.4/docker-0.3.4-aarch64-unknown-linux-gnu.tar.gz",
              "sha256": "sha256:2caa2d54f1a04b5d8bc74de7c9129125eb129fd3959e8f86791d017e4f82a417",
              "size_bytes": 3322209,
              "signature": "21e483fcc82fdb10db7a922a1e4f9e580281b48bfc79870aad519a61b0645295291536663cba2983e5217c6cda9880c51aad86fea5d41a54fba43e479f53660a"
            },
            {
              "filename": "docker-0.3.4-x86_64-apple-darwin.tar.gz",
              "format": "tar.gz",
              "target": "x86_64-apple-darwin",
              "url": "https://github.com/limmytian/voidb-plugin-docker/releases/download/v0.3.4/docker-0.3.4-x86_64-apple-darwin.tar.gz",
              "sha256": "sha256:fbc0b1b7c8e8ec1d4dd8eea73c1b6253e7af7bc2dcd53e1d521caeb27cb25e04",
              "size_bytes": 3172897,
              "signature": "5c7f8377defcc360b5d7c1e7d1d9365108b91f3710e6967803bfeca82f6a8ae152dfa462f385463a708ae953ab3a8b56f619e2b429a7a8aeb5ea048238e88901"
            },
            {
              "filename": "docker-0.3.4-x86_64-unknown-linux-gnu.tar.gz",
              "format": "tar.gz",
              "target": "x86_64-unknown-linux-gnu",
              "url": "https://github.com/limmytian/voidb-plugin-docker/releases/download/v0.3.4/docker-0.3.4-x86_64-unknown-linux-gnu.tar.gz",
              "sha256": "sha256:f4d39f8ffc05fc33215983e08a15cdd912077b16280e530ef12086e1f8754e84",
              "size_bytes": 3599604,
              "signature": "5b37e75d59c7e12cd132894bd7b31eeb506a57efe83cf2eb229f62d8a0a48c94cb1829c6fe28fde3d051eb10a104c775b4ac6d8004cfffa737de15136556560b"
            }
          ]
        },
        {
          "version": "0.3.5",
          "protocol_version": "1",
          "released_at": "2026-11-02T00:32:57.320900601Z",
          "voidb_core": ">=0.3.3",
          "platforms": [
            "darwin",
            "linux"
          ],
          "signature_scheme": "ed25519",
          "packages": [
            {
              "filename": "docker-0.3.5-aarch64-apple-darwin.tar.gz",
              "format": "tar.gz",
              "target": "aarch64-apple-darwin",
              "url": "https://github.com/limmytian/voidb-plugin-docker/releases/download/v0.3.5/docker-0.3.5-aarch64-apple-darwin.tar.gz",
              "sha256": "sha256:92990f08bc93147d1c333c58d12efb9af3723c0ce559f3f20a15d19c48e5a8f2",
              "size_bytes": 3088328,
              "signature": "3fa88dbd140a549687570f98b79450ba5921af2e66e7cc2cc1ea9f3e488fbf4cd06da7d022f5c952f4d95182851c97fba20c983d0ffb5fe91394748315902b05"
            },
            {
              "filename": "docker-0.3.5-aarch64-unknown-linux-gnu.tar.gz",
              "format": "tar.gz",
              "target": "aarch64-unknown-linux-gnu",
              "url": "https://github.com/limmytian/voidb-plugin-docker/releases/download/v0.3.5/docker-0.3.5-aarch64-unknown-linux-gnu.tar.gz",
              "sha256": "sha256:f6d4495a123c1790b35676d19a9461053b2e64c7d7009831cdce3a9413d562d4",
              "size_bytes": 4121908,
              "signature": "43e3574c9802785240c03dc86ef4cb28370b559c5ffad75553183749a2a55a7da4e7aaed5eac0741f724bd9873bc6ed4fef89d9f65b0c196a173c8d7057ff10e"
            },
            {
              "filename": "docker-0.3.5-x86_64-apple-darwin.tar.gz",
              "format": "tar.gz",
              "target": "x86_64-apple-darwin",
              "url": "https://github.com/limmytian/voidb-plugin-docker/releases/download/v0.3.5/docker-0.3.5-x86_64-apple-darwin.tar.gz",
              "sha256": "sha256:273e233f0f4422ed5dffcdffb87e5e45769472641638696651827e941b240c7c",
              "size_bytes": 3197777,
              "signature": "2c95ccb4a051be90978d42ea0fede3d491d68f940c50c7411d667f9751fbb1b5170e0bccfffca81a6bc745013ccf078680315f8cf1f0f5abbe1f010e97fa7403"
            },
            {
              "filename": "docker-0.3.5-x86_64-unknown-linux-gnu.tar.gz",
              "format": "tar.gz",
              "target": "x86_64-unknown-linux-gnu",
              "url": "https://github.com/limmytian/voidb-plugin-docker/releases/download/v0.3.5/docker-0.3.5-x86_64-unknown-linux-gnu.tar.gz",
              "sha256": "sha256:e98d8c36dcc21ea162454a82d2d6cf1d0d2f1edc4b7dc7ca50f855bd5363939d",
              "size_bytes": 3942959,
              "signature": "e8853676c33008453e888f328fdad5d63ed8052b3ff77440901829ddeb6504970278a3590fed7ba55a5b033c0115b5b1451a66e8128d990c7840e35fd26d5d00"
            }
          ]
        }
      ]
    },
    {
      "id": "duckdb",
      "name": "DuckDB Database Plugin",
      "description": "DuckDB embedded database process plugin for VoidB.",
      "homepage": "https://github.com/limmytian/voidb-plugin-duckdb",
      "license": "Apache-2.0",
      "category": "database",
      "tags": [
        "duckdb"
      ],
      "capabilities": [
        "query",
        "explain",
        "exec",
        "catalogs",
        "tables",
        "describe_table",
        "export_query",
        "import_plan",
        "import_apply"
      ],
      "latest_version": "0.3.4",
      "versions": [
        {
          "version": "0.3.3",
          "protocol_version": "1",
          "released_at": "2026-10-11T19:19:24.950489Z",
          "voidb_core": ">=0.3.3",
          "platforms": [
            "darwin",
            "linux"
          ],
          "packages": [
            {
              "filename": "duckdb-0.3.3-aarch64-apple-darwin.tar.gz",
              "format": "tar.gz",
              "target": "aarch64-apple-darwin",